{
  "schemaVersion": 1,
  "checkId": "dual-format-roundtrip",
  "status": "passed",
  "assertions": [
    {
      "id": "self-contained-svg-png",
      "status": "passed"
    },
    {
      "id": "save-reopen-roundtrip",
      "status": "passed"
    },
    {
      "id": "same-document-copy",
      "status": "passed"
    },
    {
      "id": "cross-document-copy",
      "status": "passed"
    },
    {
      "id": "print-and-pdf-output",
      "status": "passed"
    },
    {
      "id": "works-without-formulabridge",
      "status": "passed"
    }
  ]
}
